{
  "$schema": "https://json-schema.org/draft/2020-12/schema",
  "$id": "field-ownership.schema.json",
  "title": "Agent Plane Field Ownership v1",
  "type": "object",
  "additionalProperties": false,
  "required": ["schema_version", "planes", "join_rules", "happens_before_rules", "legacy_field_observation"],
  "properties": {
    "schema_version": {"const": "1.0"},
    "planes": {
      "type": "object",
      "additionalProperties": false,
      "required": ["provider", "domain", "sse", "db_events", "conversation"],
      "properties": {
        "provider": {"$ref": "#/$defs/ownership"},
        "domain": {"$ref": "#/$defs/ownership"},
        "sse": {"$ref": "#/$defs/ownership"},
        "db_events": {"$ref": "#/$defs/ownership"},
        "conversation": {"$ref": "#/$defs/ownership"}
      }
    },
    "join_rules": {
      "type": "array",
      "minItems": 1,
      "items": {"$ref": "#/$defs/joinRule"}
    },
    "happens_before_rules": {
      "type": "array",
      "minItems": 1,
      "items": {"$ref": "#/$defs/orderRule"}
    },
    "legacy_field_observation": {
      "type": "object",
      "additionalProperties": false,
      "required": ["expectations"],
      "properties": {
        "expectations": {
          "type": "object",
          "minProperties": 1,
          "additionalProperties": {"$ref": "#/$defs/fieldExpectation"}
        }
      }
    }
  },
  "$defs": {
    "ownership": {
      "type": "object",
      "additionalProperties": false,
      "required": ["owns", "forbidden"],
      "properties": {
        "owns": {
          "type": "array",
          "minItems": 1,
          "uniqueItems": true,
          "items": {"$ref": "#/$defs/ownedClaim"}
        },
        "forbidden": {
          "type": "array",
          "uniqueItems": true,
          "items": {"type": "string", "pattern": "^[A-Za-z_][A-Za-z0-9_]*$"}
        }
      }
    },
    "ownedClaim": {
      "type": "object",
      "additionalProperties": false,
      "required": ["claim", "payload_paths"],
      "properties": {
        "claim": {"type": "string", "pattern": "^[a-z][a-z0-9_]*$"},
        "payload_paths": {
          "type": "array",
          "minItems": 1,
          "uniqueItems": true,
          "items": {"$ref": "#/$defs/pointerPattern"}
        }
      }
    },
    "pointerPattern": {
      "type": "string",
      "pattern": "^(?:/(?:\\*|[^~/]|~[01])*)*$"
    },
    "fieldExpectation": {
      "type": "object",
      "additionalProperties": false,
      "required": ["default", "overrides"],
      "properties": {
        "default": {"enum": ["present", "absent"]},
        "overrides": {
          "type": "object",
          "additionalProperties": false,
          "properties": {
            "provider": {"enum": ["present", "absent"]},
            "domain": {"enum": ["present", "absent"]},
            "sse": {"enum": ["present", "absent"]},
            "db_events": {"enum": ["present", "absent"]},
            "conversation": {"enum": ["present", "absent"]}
          }
        }
      }
    },
    "fixtureSets": {
      "type": "array",
      "minItems": 1,
      "uniqueItems": true,
      "items": {"enum": ["legacy_characterization", "contract_v1"]}
    },
    "pointerScope": {
      "type": "object",
      "additionalProperties": false,
      "required": ["plane", "pointer_prefix"],
      "properties": {
        "plane": {"enum": ["provider", "domain", "sse", "db_events", "conversation"]},
        "pointer_prefix": {"type": "string", "pattern": "^(?:/(?:[^~/]|~[01])*)*$"}
      }
    },
    "joinRule": {
      "type": "object",
      "additionalProperties": false,
      "required": ["id", "fixture_sets", "operator", "minimum_references", "allowed_references"],
      "properties": {
        "id": {"type": "string", "pattern": "^[a-z][a-z0-9_.-]+$"},
        "fixture_sets": {"$ref": "#/$defs/fixtureSets"},
        "operator": {"const": "equal"},
        "minimum_references": {"type": "integer", "minimum": 2},
        "allowed_references": {
          "type": "array",
          "minItems": 2,
          "items": {"$ref": "#/$defs/pointerScope"}
        }
      }
    },
    "orderRule": {
      "type": "object",
      "additionalProperties": false,
      "required": ["id", "fixture_sets", "order_types", "before_references", "after_references"],
      "properties": {
        "id": {"type": "string", "pattern": "^[a-z][a-z0-9_.-]+$"},
        "fixture_sets": {"$ref": "#/$defs/fixtureSets"},
        "order_types": {
          "type": "array",
          "minItems": 1,
          "uniqueItems": true,
          "items": {"enum": ["integer", "number", "rfc3339"]}
        },
        "before_references": {
          "type": "array",
          "minItems": 1,
          "items": {"$ref": "#/$defs/pointerScope"}
        },
        "after_references": {
          "type": "array",
          "minItems": 1,
          "items": {"$ref": "#/$defs/pointerScope"}
        }
      }
    }
  }
}
