{
  "schema_version": "1.0",
  "planes": {
    "provider": {
      "owns": [
        {"claim": "provider_request", "payload_paths": ["/exchanges/*/request"]},
        {"claim": "provider_result", "payload_paths": ["/exchanges/*/result"]},
        {"claim": "provider_error", "payload_paths": ["/exchanges/*/error"]},
        {"claim": "provider_exchange_metadata", "payload_paths": ["/exchanges/*/service", "/exchanges/*/boundary_id", "/exchanges/*/source_symbol", "/exchanges/*/operation"]}
      ],
      "forbidden": ["session_state", "message_metadata", "interaction_blocks", "interaction_checks", "active_skill_id", "active_step_id", "feedback_rating"]
    },
    "domain": {
      "owns": [
        {"claim": "turn_request", "payload_paths": ["/request"]},
        {"claim": "router_decision", "payload_paths": ["/router_decision"]},
        {"claim": "step_result", "payload_paths": ["/step_result"]},
        {"claim": "tool_result", "payload_paths": ["/tool_result"]},
        {"claim": "turn_outcome", "payload_paths": ["/outcome"]},
        {"claim": "action_facts", "payload_paths": ["/facts"]}
      ],
      "forbidden": ["provider_credentials", "provider_internal_ref", "interaction_blocks", "interaction_checks"]
    },
    "sse": {
      "owns": [
        {"claim": "http_exchange", "payload_paths": ["/http"]},
        {"claim": "event", "payload_paths": ["/events/*/event"]},
        {"claim": "data", "payload_paths": ["/events/*/data"]},
        {"claim": "delivery_order", "payload_paths": ["/events/*/sequence"]}
      ],
      "forbidden": ["provider_credentials", "provider_internal_ref"]
    },
    "db_events": {
      "owns": [
        {"claim": "event_type", "payload_paths": ["/events/*/event_type"]},
        {"claim": "payload", "payload_paths": ["/events/*/payload"]},
        {"claim": "observed_row_order", "payload_paths": ["/events/*/observed_row_order"]}
      ],
      "forbidden": ["provider_credentials"]
    },
    "conversation": {
      "owns": [
        {"claim": "messages", "payload_paths": ["/messages"]},
        {"claim": "session", "payload_paths": ["/session"]},
        {"claim": "interaction_checks", "payload_paths": ["/interaction_checks"]},
        {"claim": "sync_response", "payload_paths": ["/sync_response"]},
        {"claim": "persisted_session_evidence", "payload_paths": ["/persisted_pre_state", "/persisted_session"]}
      ],
      "forbidden": ["provider_credentials", "provider_internal_ref"]
    }
  },
  "join_rules": [
    {
      "id": "legacy.turn_message_identity",
      "fixture_sets": ["legacy_characterization"],
      "operator": "equal",
      "minimum_references": 2,
      "allowed_references": [
        {"plane": "domain", "pointer_prefix": "/request"},
        {"plane": "domain", "pointer_prefix": "/outcome"},
        {"plane": "db_events", "pointer_prefix": "/events"},
        {"plane": "conversation", "pointer_prefix": "/messages"}
      ]
    },
    {
      "id": "legacy.durable_event_identity",
      "fixture_sets": ["legacy_characterization"],
      "operator": "equal",
      "minimum_references": 2,
      "allowed_references": [
        {"plane": "sse", "pointer_prefix": "/events"},
        {"plane": "db_events", "pointer_prefix": "/events"}
      ]
    },
    {
      "id": "legacy.attachment_identity",
      "fixture_sets": ["legacy_characterization"],
      "operator": "equal",
      "minimum_references": 3,
      "allowed_references": [
        {"plane": "domain", "pointer_prefix": "/request/attachments"},
        {"plane": "conversation", "pointer_prefix": "/messages"},
        {"plane": "conversation", "pointer_prefix": "/interaction_checks"}
      ]
    },
    {
      "id": "legacy.feedback_target_identity",
      "fixture_sets": ["legacy_characterization"],
      "operator": "equal",
      "minimum_references": 3,
      "allowed_references": [
        {"plane": "conversation", "pointer_prefix": "/messages"},
        {"plane": "conversation", "pointer_prefix": "/interaction_checks"}
      ]
    },
    {
      "id": "legacy.graph_step_identity",
      "fixture_sets": ["legacy_characterization"],
      "operator": "equal",
      "minimum_references": 2,
      "allowed_references": [
        {"plane": "domain", "pointer_prefix": "/facts"},
        {"plane": "db_events", "pointer_prefix": "/events"}
      ]
    },
    {
      "id": "legacy.graph_pending_identity",
      "fixture_sets": ["legacy_characterization"],
      "operator": "equal",
      "minimum_references": 2,
      "allowed_references": [
        {"plane": "domain", "pointer_prefix": "/facts"},
        {"plane": "db_events", "pointer_prefix": "/events"}
      ]
    },
    {
      "id": "target.committed_message_identity",
      "fixture_sets": ["contract_v1"],
      "operator": "equal",
      "minimum_references": 2,
      "allowed_references": [
        {"plane": "sse", "pointer_prefix": "/events"},
        {"plane": "db_events", "pointer_prefix": "/events"},
        {"plane": "conversation", "pointer_prefix": "/sync_response"},
        {"plane": "conversation", "pointer_prefix": "/messages"}
      ]
    }
  ],
  "happens_before_rules": [
    {
      "id": "legacy.observed_event_order",
      "fixture_sets": ["legacy_characterization"],
      "order_types": ["integer", "number", "rfc3339"],
      "before_references": [
        {"plane": "sse", "pointer_prefix": "/events"},
        {"plane": "db_events", "pointer_prefix": "/events"}
      ],
      "after_references": [
        {"plane": "sse", "pointer_prefix": "/events"},
        {"plane": "db_events", "pointer_prefix": "/events"}
      ]
    }
  ],
  "legacy_field_observation": {
    "expectations": {
      "run_id": {"default": "absent", "overrides": {}},
      "interaction_id": {"default": "absent", "overrides": {}}
    }
  }
}
